Nepali,English
स्थानीय वीर डोमलाल राजबंशीको नाममा बनाइएको यस पार्कमा हिँड्दा तपाईं झापाको सम्पदामा गर्व महसुस गर्नुहुन्छ र यसले बोकेका साहसका कथाहरू सम्झनुहुन्छ,walking through this park dedicated to a local hero you feel proud of jhapas heritage and the stories of courage it carries
सतासीधाम झरनाको गड्गडाहटले तपाईंलाई ऊर्जा दिन्छ,the sound of the satasidham waterfall crashing down fills you with energy
यो प्रकृतिको अजेय शक्तिको सम्झना हो,its a reminder of natures unstoppable power
मेची रंगशालामा स्थानीय फुटबल खेल हेर्दा भीडको जयकार तपाईका कानमा प्रतिध्वनित हुन्छ प्रतिस्पर्धाको उत्साहले तपाईलाई भरिदिन्छ,watching a local football match at mechi stadium the cheers of the crowd echo in your ears filling you with the thrill of competition
स्वाद र परम्परामा धनी राजबंशी परिकारले तपाईलाई खाना कसरी मानिसहरूलाई एकसाथ ल्याउँछ भन्ने सम्झाउँछ,the rajbanshi cuisine rich in flavor and tradition reminds you of how food brings people together
हरेक परिकार एउटा उत्सवजस्तो लाग्छ,each dish feels like a celebration
झापामा सामुदायिक भावना बलियो छ,the sense of community in jhapa is strong
छिमेकीहरू एकअर्कालाई सहयोग गर्छन् र पर्वहरूले सबैलाई एकसाथ ल्याउँछन्,neighbors help each other and festivals bring everyone together
साथीहरू नमस्ते आज हामी डोलखाको अद्भुत भिमेश्वर मन्दिरमा छौं,hi friends were at the amazing bhimeshwor temple in dolakha today
म यो सुन्दर ठाउँ देखाउन पाउँदा निकै उत्साहित छु,im so excited to show you around this beautiful place
के तपाईंले विश्वास गर्न सक्नुहुन्छ यहाँको मूर्ति देशमा केही नराम्रो हुँदा पसिना आउँछ भन्ने भनाइ छ,can you believe that the statue here is said to sweat when something bad happens in the country
केही स्थानीयहरू भन्छन् कि यो विपत्तिको संकेत हो डरलाग्दो कुरा होइन र,some locals even say that its a sign of disaster creepy right
तर चारैतिर हेर्नुहोस् दृश्य कति अद्भुत छ पहाडहरू मन्दिर सबै कति शान्त छन्,but look around the view is just incredible the hills the temple everything is so peaceful
तर दुखको कुरा के छ भने यो मन्दिरको बारेमा सबैलाई थाहा छैन,its sad though that not everyone knows about this temple
यदि तपाईं यहाँ आउनुभएको छैन भने एकचोटि अवश्य आउनुहोस् यो धेरै विशेष ठाउँ हो,if you havent been here you really should visit its such a special place
अनि सुन्नुस् अनुमान लगाउनुहोस् त मन्दिरलाई  वर्षभन्दा पुरानो मानिन्छ कस्तो अचम्मको कुरा हो होइन र,oh and guess what the temple is believed to be more than  years old isnt that amazing
दुखको कुरा केही मानिसहरूले यस क्षेत्रको राम्रो हेरचाह गर्दैनन् यहाँ फोहोर फ्याँक्नु साँच्चै निराशाजनक छ,sadly there are people who dont take care of the area properly littering around here is really disappointing
हामी सबैले हाम्रो सांस्कृतिक स्थलहरूको सम्मान गर्नुपर्छ यस्तो व्यवहार देख्दा मलाई धेरै रिस उठ्छ,we should all respect our cultural sites it makes me so angry to see this kind of behavior
मलाई यस्तो पुरानो मन्दिरमा सधैं अलि असजिलो महसुस हुन्छ तपाईंलाई पनि लाग्दैन र यहाँको वातावरण नै रहस्यमयी छ,i always feel a bit nervous in old temples like this dont you they have such a mysterious vibe
तर समग्रमा प्रकृति र संस्कृतिमा रुचि राख्नेहरूका लागि यो घुम्नको लागि उत्कृष्ट स्थान हो,but overall its a great place to visit if you love nature and culture
मलाई आशा छ कि धेरै मानिसहरूले यहाँ आएर यस सुन्दर सम्पदाको संरक्षणमा मद्दत गर्लान्,i wish more people would come here and help preserve this beautiful heritage
ओहो तपाईंले त्यो घण्टी बजेको सुन्नुभयो यसले यो स्थानको पवित्र भावनामा अझै जोड दिएको छ,oh wow did you just hear that bell ring it really adds to the sacred feel of this place
ठीक छ आजको लागि यत्ति नै हो आशा छ तपाईंले भिमेश्वर मन्दिरको यो सानो यात्रा रमाइलो पाउनुभयो,alright thats it for today i hope you enjoyed this little tour of bhimeshwor temple
तपाईंलाई यो भिडियो मन परेमा सब्स्क्राइब गर्न नबिर्सिनुहोला अर्को साहसिक यात्रामा भेटौंला,make sure to subscribe if you liked the video and ill see you on the next adventure
साथीहरू नमस्ते आज हामी सुन्दर बौद्धनाथ स्तूपामा छौं,hi guys today were at the beautiful boudhanath stupa
यो काठमाडौंको मेरा मनपर्ने ठाउँहरू मध्ये एक हो,its one of my favorite places in kathmandu
तपाईंलाई विश्वास लाग्छ कति ठूलो छ त्यो गुम्बजको आकार हेर्नुहोस्,can you believe how huge it is look at the size of that dome
कथा अनुसार यो स्तूपाले शताब्दीयौँको इतिहास देखेको छ यो कति पुरानो हो भन्ने कुरा सोच्दा अलि डर लाग्छ,the stories say this stupa has seen centuries of history its kind of spooky to think about how old it is
तर चारैतिर हेर्नुहोस् यहाँ कति शान्त छ यो शान्त वातावरणले तपाईंलाई धेरै राम्रो महसुस गराउँछ,but just look around its so peaceful here the calmness really makes you feel good
तर केहि भाग समयसँगै बिग्रिएको देख्दा दुख लाग्छ,its sad to see that some parts of the stupa are damaged over time
मलाई मन पर्दैन जब मानिसहरू यस पवित्र ठाउँमा फोहोर फ्याँक्छन् यसले सुन्दरतामा धक्का पुर्याउँछ,i wish people wouldnt litter around this sacred place it ruins the beauty
हावामा फरफराइरहेका प्रार्थना झण्डाहरू धेरै रंगीन र सुन्दर देखिन्छन्,the prayer flags fluttering in the wind look so colorful and beautiful
ओहो त्यो घण्टीको आवाज सुन्नुभयो कति ठूलो छ सबैतिर गुन्जिएको छ,oh wow did you hear that bell its so loud it echoes all around
यो स्थानको महत्त्व धेरै मानिसलाई थाहा छैन भन्ने कुरा दुख लाग्दो छ,its sad that not many people know about the importance of this place
यहाँ आउन पाउँदा र तपाईंहरू सबैसँग यो बाँड्न पाउँदा म धेरै भाग्यशाली महसुस गर्छु,i feel really lucky to be here and share this with you all
हामी सबैले हाम्रो सांस्कृतिक स्थलहरूको हेरचाह गर्नुपर्छ मानिसहरूले यसलाई सम्मान नगर्दा मलाई धेरै रिस उठ्छ,we all need to take care of our cultural sites it makes me mad when people dont respect them
राति यहाँ हिंडेको कल्पना गर्नुहोस् अलि डर लाग्दो हुन्थ्यो होइन र,imagine walking here at night it would be a little scary dont you think
अनि अनुमान लगाउनुहोस् त यो स्तूपा  वर्षभन्दा पुरानो छ कस्तो अचम्मको कुरा हो,and guess what this stupa is more than  years old thats incredible
आजको भ्लगका लागि यत्ति नै हो आशा छ तपाईंले यो मेरो जत्तिकै रमाइलो पाउनुभयो,thats all for todays vlog i hope you enjoyed it as much as i did
लाइक बटन थिच्न र अरु अद्भुत ठाउँहरूको लागि सब्स्क्राइब गर्न नबिर्सिनुहोला,dont forget to hit the like button and subscribe for more amazing places
साथीहरू नमस्ते हामी आज बुढानीलकण्ठ मन्दिरमा छौं,hey everyone were here at budhanilkantha temple today
यो ठाउँ कति शान्त र सुन्दर छ वरिपरि हरिया पहाडहरूले घेरेको,this place is so peaceful and beautiful surrounded by green hills
ओहो त्यो मूर्तिको आकार हेर्नुहोस् कति ठूलो छ र कति बिस्तृत,wow look at the size of that statue its huge and so detailed
उनीहरू भन्छन् यो मूर्ति हजार वर्षभन्दा पुरानो हो त्यो सोच्दा पनि मेरो शरीरमा काँडा आउँछ,they say the statue has been here for over  years just thinking about that gives me chills
यहाँ सारा ठाउँबाट मानिसहरू प्रार्थना गर्न र फूल चढाउन आउँछन् उनीहरूको आस्था देख्दा प्रेरणादायी लाग्छ,people from all over come here to pray and offer flowers its inspiring to see their faith
तर मन्दिरको केहि भाग राम्रोसँग स्याहार नगरिएको देख्दा दुख लाग्छ,but its sad to see some parts of the temple are not well maintained
मैले चाहन्छु कि मानिसहरूले यस पवित्र स्थलको राम्रो हेरचाह गरून्,i really wish people would take better care of this sacred place
यहाँ घण्टी बजिरहेको आवाजले शान्त र आध्यात्मिक भावना थप्छ,the sound of the bells ringing here adds to the calm and spiritual feeling
तपाईंलाई थाहा छ मूर्ति एकै ढुङ्गाबाट बनाइएको हो यो साँच्चै अचम्मको कुरा हो,and did you know the statue is carved from a single stone thats just incredible
यहाँ मानिसहरूले फोहोर फ्याँकिरहेको देख्दा मलाई साँच्चै नरमाइलो लाग्छ यो त पवित्र ठाउँ हो,but seeing people litter around here really bothers me this is a holy place
रातको समयमा यहाँ मूर्तिहरूसँग मात्र हिंड्नु पर्ने कल्पना गर्नुहोस् अलि डर लाग्दो हो होइन र,imagine walking here at night with only the statues around that would be a little scary dont you think
जे भए पनि यदि तपाईं काठमाडौंमा हुनुहुन्छ भने यो मन्दिर अवश्य आउनुपर्ने ठाउँ हो,anyway this temple is a mustvisit if youre ever in kathmandu
मलाई यो विशेष स्थानको बारेमा धेरै मानिसहरूलाई थाहा भइदिए हुन्थ्यो भन्ने लाग्छ,i just wish more people knew about this special place
ओहो मूर्तिमा गरिएको कुँदाइको विवरण अचम्मको छ,oh wow the details of the carvings on the statue are mindblowing
आजको भ्लगको लागि यत्ति नै हो तपाईंले मेरो साथमा बुढानीलकण्ठको यात्रा रमाइलो गर्नुभयो भन्ने आशा छ,thats it for todays vlog i hope you enjoyed exploring budhanilkantha with me
अरु रमाइलो यात्राहरूका लागि लाइक सेयर र सब्स्क्राइब गर्न नबिर्सिनुहोला,dont forget to like share and subscribe for more fun journeys ahead
साथीहरू नमस्ते हामी भक्तपुरको चाँगुनारायण मन्दिरमा छौं,hi everyone were here at changunarayan temple in bhaktapur
यो नेपालकै सबैभन्दा पुरानो मन्दिरहरूमध्ये एक हो  वर्षभन्दा पुरानो,this is one of the oldest temples in nepal over  years old
यहाँको वास्तुकला साँच्चै अचम्मको छ र ठाउँ पनि कति शान्त छ,the architecture is so amazing and the place feels so peaceful
केहि भाग समयसँगै बिग्रिएको देख्दा दुख लाग्छ,its sad to see that some parts of the temple are damaged by time
वाह ती प्राचीन ढुंगाका मूर्तिहरू हेर्नुहोस् कति बिस्तृत छन्,wow look at those ancient stone carvings theyre so detailed
यो ठाउँमा विशेष ऊर्जा छ यहाँ आउँदा इतिहासमै पाइला राखेजस्तो लाग्छ,this place has a special energy it feels like stepping into history
सोच्नुहोस् यस मन्दिरले कति शताब्दीयौँको इतिहास देखेको छ यसले मलाई काँडा उठाउँछ,imagine how many centuries of history this temple has seen it gives me chills
मानिसहरू यहाँ प्रार्थना गर्न र विगतसँग जोडिन आउँछन् यो प्रेरणादायी छ,people come here to pray and to feel connected to the past its inspiring
तर मन्दिरको वरिपरि फोहोर देख्दा मलाई साँच्चै नरमाइलो लाग्छ हामीले यस ठाउँको बढी सम्मान गर्नुपर्छ,but seeing litter around the temple makes me really sad we should respect this place more
यहाँबाट देखिने दृश्य साँच्चै सुन्दर छ वरिपरि पहाडहरूले घेरेको,the view from here is just beautiful with the hills all around
तपाईंलाई थाहा छ चाँगुनारायण युनेस्कोको विश्व सम्पदा सूचीमा पनि समावेश छ,did you know changunarayan is also a unesco world heritage site
मलाई यो मन्दिर कति महत्वपूर्ण छ भन्ने कुरा धेरैले थाहा भइदिए हुन्थ्यो भन्ने लाग्छ,i just wish more people knew how important this temple is
जे भए पनि यहाँ आउन पाउँदा र तपाईं सबैसँग यो बाँड्न पाउँदा मलाई खुशी लागेको छ,anyway im so glad to be here and share this with you all
यो हेर्नुहोस् काठ र ढुङ्गामा गरिएको मूर्तिकला यति बिस्तृत छ विश्वास गर्न गाह्रो छ,look at this the carvings on the wood and stone are so detailed its hard to believe
हामीले यस ठाउँको ख्याल गर्नुपर्छ मानिसहरूले यी सांस्कृतिक स्थलहरूको सम्मान नगर्दा मलाई रिस उठ्छ,we really need to take care of this place it makes me mad when people dont respect these cultural sites
आजको भ्लगको लागि यत्ति नै हो तपाईंले मेरो साथमा चाँगुनारायणको यात्रा रमाइलो गर्नुभयो भन्ने आशा छ,thats all for todays vlog i hope you had fun exploring changunarayan with me
अरु रमाइलो ठाउँहरूको लागि लाइक सेयर र सब्स्क्राइब गर्न नबिर्सिनुहोला,dont forget to like share and subscribe for more great places to visit
साथीहरू नमस्कार आज हामी काठमाडौंको प्रसिद्ध दक्षिणकाली मन्दिरमा आएका छौँ,hi everyone today were visiting dakshinkali temple one of the famous temples in kathmandu
कति धेरै मानिसहरू यहाँ प्रार्थना र बलिका लागि आउने गर्छन् विशेष गरी शनिबारका दिन,its amazing how many people come here for prayers and sacrifices especially on saturdays
यो ठाउँ निकै सुन्दर छ र वरिपरि रुखहरू र बग्ने नदीले घेरेको छ,the location is beautiful surrounded by trees and a flowing river nearby
कहिलेकाहीँ यो कति भिड हुने गर्छ र शान्त वातावरण हराएको जस्तो लाग्छ देख्दा दुख लाग्छ,sometimes its sad to see how crowded it gets and the calm atmosphere can feel lost
तपाईंलाई थाहा छ मानिसहरूले यहाँ प्रार्थना गरेपछि उनीहरूको भाग्य र खुशी आउने विश्वास गर्छन्,did you know people believe praying here will bring them luck and happiness
अहिले चलिरहेका अनुष्ठानहरू हेर्नुहोस् यो पूर्ण भक्तिभाव र ऊर्जाले भरिएको छ,look at the rituals being performed right now its full of devotion and energy
तर जनावरको बलिको विचारले केही मानिसहरूलाई डर लाग्न सक्छ विशेष गरी यसमा अभ्यस्त नभएकाहरूलाई,but the thought of animal sacrifices can feel intense for some people especially for those who arent used to it
बलिदानहरू देख्दा केही मानिसहरूलाई असहज महसुस हुन सक्छ तर यो मन्दिरको परम्पराको एउटा हिस्सा हो,it can be uncomfortable for some to witness the sacrifices but its a part of the temples tradition
साथीहरू वा परिवारसँग एक शान्त दिन बिताउनका लागि वरपरको वातावरण उपयुक्त छ,the surroundings are perfect for a peaceful day out with friends or family
वाह यहाँबाट देखिने पहाडको दृश्य हेर्नुहोस् यो साँच्चै मनमोहक छ,wow look at the view of the hills from here its breathtaking
यो दुखको कुरा हो कि सबै आगन्तुकहरूले मन्दिरको क्षेत्रलाई सम्मान गर्दैनन् र कहिलेकाहीँ फोहोर छोडिदिन्छन्,its unfortunate that not all visitors respect the temple area and sometimes leave trash behind
यस्तो पवित्र ठाउँमा मानिसहरूले फोहोर गरेको देख्दा मलाई रिस उठ्छ,it makes me angry when i see people littering around such a sacred place
तैपनि म यहाँ आउन पाएको र तपाईं सबैसँग यो अनुभव बाँड्न पाएकोमा आभारी छु,still im grateful to be here and share this experience with you all
ओहो अहिले ठूलो अनुष्ठान चलिरहेको छ जाउँ यसलाई नजिकबाट हेरौँ,oh theres a big ritual happening now lets go and take a closer look
कहिलेकाहीँ यहाँका अनुष्ठान र बलि संस्कृति नबुझेकाहरूलाई अलि बढी लाग्न सक्छ,sometimes the rituals and sacrifices can be a bit overwhelming for those who are not familiar with the culture
आजको भ्लगका लागि यत्ति नै हो आशा छ तपाईंले मेरो साथमा दक्षिणकाली मन्दिरको यात्रा रमाइलो गर्नुभयो,thats all for todays vlog i hope you enjoyed exploring dakshinkali temple with me
अरु रोमाञ्चक यात्राहरूको लागि लाइक सेयर र सब्स्क्राइब गर्न नबिर्सिनुहोला,dont forget to like share and subscribe for more exciting journeys ahead
साथीहरू नमस्कार आज हामी देवघाटमा छौं यो नेपालकै शान्त र पवित्र ठाउँ हो,hi friends were at devghat today a peaceful and holy place in nepal
वाह यहाँ दुईवटा नदीहरू मिलिरहेका छन् हैन कति सुन्दर र विशेष छ,wow look at the two rivers meeting here its so beautiful and special
धेरै मानिसहरू यहाँ प्रार्थना र आरामका लागि आउने गर्छन् विशेष गरी चाडपर्वको समयमा,many people visit here to pray and relax especially during festivals
